,Datetime,Hash,Parent,Author,Commit Msg,Filepath,Filename,Removed Test Case,Referenced Functions,Deleted With Source Code,Deleted With Source Code Decision,Deleted With Whole File,Type,Type Details,Frank Type,Suraj Type,Final Type,Resolved Final Type,Frank Remarks,Suraj Remarks,Test Run,Test Fail Reason,BC Before Covered,BC Before Total,BC Before Cov %,BC After Covered,BC After Total,BC After Cov %,LC Before Covered,LC Before Total,LC Before Cov %,LC After Covered,LC After Total,LC After Cov %,Mutation Run,MC Before Killed,MC Before Total,MC Before Cov %,MC After Killed,MC After Total,MC After Cov %,BC Loss %,LC Loss %
0,07/25/2002 20:40:11,e950d9b37e97f8573f0655520b88900e8acb2869,742a42dbf347f6244dd37a7edee72ec2f8ca977f,dlr@apache.org,"Removed two broken methods from StringUtils.  Since a beta has gone out,
this is not good practice.  However, since 1.0 final has not yet been
released, it is out-weighed by the trade off of releasing code that just
plain doesn't work.

Use str.getBytes(encoding) in place of convertUnicodeToNative().

Use new String(byte[], encoding) in place of convertNativeToUnicode().


git-svn-id: https://svn.apache.org/repos/asf/jakarta/commons/proper/lang/trunk@136945 13f79535-47bb-0310-9956-ffa450edef68",src/test/org/apache/commons/lang/StringUtilsTest.java,StringUtilsTest.java,testUnicodeFunctions,,yes,undecided,no,concurrent obsolete,na,not obsolete,not obsolete,not obsolete,not obsolete,the code within the test case was commented out,empty test,passed,,6,13,461538.0,6,13,461538.0,15,27,555556.0,15,27,555556.0,failed,0,0,#DIV/0!,0,0,#DIV/0!,0,0
1,07/30/2005 20:17:01,3535bf265b3eb34df28ff2ee5c029065e569add8,be164675feda702a738a9b5fe49c9b5fc17ac018,ggregory@apache.org,"Better code coverage from Nathan Beyer [nbeyer@kc.rr.com].

git-svn-id: https://svn.apache.org/repos/asf/jakarta/commons/proper/lang/trunk@226597 13f79535-47bb-0310-9956-ffa450edef68",src/test/org/apache/commons/lang/text/StrBuilderTest.java,StrBuilderTest.java,testCharArray,,yes,undecided,no,concurrent obsolete,na,not obsolete,not obsolete,not obsolete,not obsolete,todo test case,empty test,passed,,12,28,428571.0,12,28,428571.0,42,65,646154.0,42,65,646154.0,passed,19,52,36.53846154,19,52,36.53846154,0,0
2,02/26/2015 2:13:58,61836183b1d84a18dbcc084d1f41bcecf752f9fd,4975b8903e359963eb48e2ad3d4095de0cfa8032,britter@apache.org,"Reverting changes from r1661762 (LANG-1086) for now until we have consensus about this change.

git-svn-id: https://svn.apache.org/repos/asf/commons/proper/lang/trunk@1662379 13f79535-47bb-0310-9956-ffa450edef68",src/test/java/org/apache/commons/lang3/concurrent/AtomicInitializerTest.java,AtomicInitializerTest.java,testGetConcurrentWithException,,yes,undecided,no,concurrent obsolete,na,not obsolete,not obsolete,not obsolete,not obsolete,,reverted back due to disagreement,passed,,3,4,750000.0,2,4,500000.0,7,8,875000.0,6,8,750000.0,passed,6,12,50,4,12,33.33333333,250000,125000
3,02/26/2015 2:13:58,61836183b1d84a18dbcc084d1f41bcecf752f9fd,4975b8903e359963eb48e2ad3d4095de0cfa8032,britter@apache.org,"Reverting changes from r1661762 (LANG-1086) for now until we have consensus about this change.

git-svn-id: https://svn.apache.org/repos/asf/commons/proper/lang/trunk@1662379 13f79535-47bb-0310-9956-ffa450edef68",src/test/java/org/apache/commons/lang3/concurrent/LazyInitializerTest.java,LazyInitializerTest.java,testGetConcurrentWithException,,yes,undecided,no,concurrent obsolete,na,not obsolete,not obsolete,not obsolete,not obsolete,,reverted back due to disagreement,passed,,3,4,750000.0,2,4,500000.0,9,9,1000000.0,6,9,666667.0,passed,6,12,50,3,12,25,250000,333333
